{
  "$schema": "../schema/partner.schema.json",
  "id": "nodebyte-hosting",
  "name": "NodeByte Hosting",
  "type": "host",
  "summary": "Fast, reliable, and secure hosting for gaming communities and businesses.",
  "logo": "https://nodebyte.host/logo.png",
  "website": "https://nodebyte.host",
  "discord": "https://discord.gg/Bg3Sf5fqa4",
  "offer": "30% off your first month with code SPOOKY30 (valid until Oct 31, 2026)",
  "tags": ["na", "eu", "usa"]
}
